{
  "runId": "5ed5bd4f-f0bd-4e5f-99d8-4895df8fc04e",
  "projectId": "example.conditional",
  "projectDigest": "58e9b573d5360c1e700195487e5813d270989a39a911635f6f63b5fc87987dad",
  "startedAt": "2026-07-17T08:46:06.203031+00:00",
  "finishedAt": "2026-07-17T08:46:06.204037+00:00",
  "status": "success",
  "inputWorkspaceHash": "3517156cbe0cd1aa4228f5da50b8d2a62943fc6f62f360d207c4885e7ef713ec",
  "finalWorkspaceHash": "46a36994307bb6d6259921bfb1f4257c72b0402bbc984ffcca66759a117aa74c",
  "bitResults": [
    {
      "bitId": "set_flag_when_area_present",
      "type": "roborean.set_variable",
      "active": true,
      "activationReason": true,
      "status": "success",
      "durationMs": 1.1766999959945679,
      "workspacePatch": {
        "ops": [
          {
            "op": "set",
            "key": "flag",
            "value": {
              "kind": "public_literal",
              "dataType": "boolean",
              "value": true
            }
          }
        ]
      },
      "documentOps": [],
      "diagnostics": [],
      "pluginVersion": "1.0.0"
    }
  ],
  "artifacts": [],
  "engineVersion": "0.1.0",
  "ruleProfileVersion": "1.0.0"
}
