{
  "runId": "c58585eb-3faf-4a26-8ac8-0e421f4c42bd",
  "projectId": "example.secret-ref",
  "projectDigest": "549a8107a2e1fa1358419afa8c148c24be56573f1ee698f61da76a6c3b818cf7",
  "startedAt": "2026-07-17T09:23:28.867651+00:00",
  "finishedAt": "2026-07-17T09:23:28.867651+00:00",
  "status": "success",
  "inputWorkspaceHash": "78cf620ccacb64cb15590bbb78232a81dbdedb40d36e3263d5af255a3e6db36f",
  "finalWorkspaceHash": "0c7cbd8e2d33fff1f81ae9554a0d183431d9c5779f4eb462c1f620bf79a18145",
  "bitResults": [
    {
      "bitId": "copy_secret_reference",
      "type": "roborean.copy_variable",
      "active": true,
      "activationReason": "always",
      "status": "success",
      "durationMs": 0.14879999798722565,
      "workspacePatch": {
        "ops": [
          {
            "op": "set",
            "key": "registry.api_token_copy",
            "value": {
              "kind": "secret_ref",
              "ref": "sec:project-default:registry-api-token",
              "displayHint": "Configured registry token"
            }
          }
        ]
      },
      "documentOps": [],
      "diagnostics": [],
      "pluginVersion": "1.0.0"
    }
  ],
  "artifacts": [],
  "engineVersion": "0.3.0",
  "ruleProfileVersion": "1.0.0"
}
